title,url,description
Firebase Leaves Beta Today,https://www.firebase.com/blog/2013-08-15-firebase-leaves-beta-today.html,article about firebase
Destructuring Assignment in ECMAScript 6,http://fitzgeraldnick.com/weblog/50/,destructuring assignment
Article,www.bo.com,Cool stuff
Robots are Pretty neat,http://robots-sauce.com,Pretty baller
I am the walrus,www.google.com,"Pretty nifty, bowie"
This is an article,here.net,"This is a long enough description for you, isn't it? God, you're so demanding."
This is a valid submission,article.net,This is a valid description.
